rank,bigram,pmi,frequency,message_count,contains_entity_term,network_score,first_seen,last_seen,example_message_id,example_timestamp,example_text,word_1,word_2
1,ariela karmel,14.78581,5,5,True,73.92905,2025-12-25 11:40:26+00:00,2026-03-16 12:43:07+00:00,6489,2025-12-25 11:40:26+00:00,Daily Briefing Dec. 25: Day 811 - Initial Knesset vote on contentious Oct. 7 probe bill sparks anger Political repor...,ariela,karmel
2,be'er sheva,14.78581,5,5,True,73.92905,2026-03-29 12:58:03+00:00,2026-04-08 21:23:37+00:00,16819,2026-03-29 12:58:03+00:00,"HAPPENING NOW: A massive fire is burning at the Neot Hovav industrial facility, south of Be’er Sheva, following an I...",be'er,sheva
3,ivan kesic,14.78581,5,5,True,73.92905,2026-04-12 15:24:45+00:00,2026-04-16 11:10:20+00:00,185178,2026-04-12 15:24:45+00:00,"✍️ Investigation - Geography, energy, asymmetric power: Strait of Hormuz as Iran's permanent strategic asset After f...",ivan,kesic
4,rossella tercatin,14.78581,5,5,True,73.92905,2025-12-28 13:39:36+00:00,2026-04-02 10:28:16+00:00,6505,2025-12-28 13:39:36+00:00,Daily Briefing Dec. 28: Day 814 - Will $35 billion gas deal with Egypt hike electricity costs? Tech editor Sharon Wr...,rossella,tercatin
5,yechiel leiter,14.522776,6,6,True,87.136654,2026-04-09 15:40:07+00:00,2026-04-15 15:33:51+00:00,74802,2026-04-09 15:40:07+00:00,"Senior Israeli official: The one who will lead the direct negotiations is Israeli Ambassador to Washington, Yechiel ...",yechiel,leiter
6,movie maven,14.522776,5,5,True,72.613878,2025-12-27 06:53:14+00:00,2026-04-08 08:12:16+00:00,6502,2025-12-27 06:53:14+00:00,The Reel Schmooze: Jack Black's mother was a rocket scientist?! Movie maven Jordan Hoffman and host Amanda Borschel-...,movie,maven
7,megyn kelly,14.522776,5,3,True,72.613878,2026-03-03 19:46:35+00:00,2026-04-17 12:20:08+00:00,7100,2026-03-03 19:46:35+00:00,"Isolationist US right-wing commentators decry Iran war; Trump says he doesn’t care Tucker Carlson, Megyn Kelly claim...",megyn,kelly
8,yad vashem,14.300383,7,7,True,100.102682,2026-01-28 02:56:04+00:00,2026-04-15 23:20:42+00:00,6724,2026-01-28 02:56:04+00:00,Counting the days: How Jews clung to the Hebrew calendar as Nazis tried to erase it A new exhibition at Yad Vashem h...,yad,vashem
9,zina rakhamilova,14.300383,7,7,True,100.102682,2026-01-13 18:01:07+00:00,2026-04-14 15:32:37+00:00,6641,2026-01-13 18:01:07+00:00,"On this episode of Off The Record, Zina Rakhamilova sits down with Or Shaked, U.S. Correspondent for Israel Hayom, I...",zina,rakhamilova
10,calvary chapel,14.300383,6,4,True,85.802299,2026-04-02 18:38:35+00:00,2026-04-16 20:07:01+00:00,74359,2026-04-02 18:38:35+00:00,"Join us for an in-depth look at the events foretold in Scripture, how they align with what we are witnessing in the ...",calvary,chapel
11,sam sokol,14.300383,5,5,True,71.501916,2025-12-25 11:40:26+00:00,2026-04-06 11:12:31+00:00,6489,2025-12-25 11:40:26+00:00,Daily Briefing Dec. 25: Day 811 - Initial Knesset vote on contentious Oct. 7 probe bill sparks anger Political repor...,sam,sokol
12,lion's roar,14.300383,5,3,True,71.501916,2026-02-28 08:20:29+00:00,2026-03-02 05:19:02+00:00,7073,2026-02-28 08:20:29+00:00,"Prime Minister Benjamin Netanyahu: “My brothers and sisters, citizens of Israel, a short while ago Israel and the Un...",lion's,roar
13,keir starmer,14.259741,5,5,True,71.298706,2026-02-28 15:06:04+00:00,2026-04-16 07:57:04+00:00,7139,2026-02-28 15:06:04+00:00,UK Prime Minister Keir Starmer Issues Statement On Iran,keir,starmer
14,candace owens,14.107738,5,3,True,70.538691,2026-03-22 09:11:46+00:00,2026-04-17 12:20:08+00:00,16617,2026-03-22 09:11:46+00:00,Candace Owens on the Iranian ballistic missile strike which wounded over a hundred Israeli civilians: “Iran has a ri...,candace,owens
15,gideon sa'ar,14.107738,6,6,True,84.646429,2026-01-05 12:28:13+00:00,2026-04-14 12:10:53+00:00,6562,2026-01-05 12:28:13+00:00,"Israel welcomed the ousting of Venezuelan dictator Nicolás Maduro, with Foreign Minister Gideon Sa’ar praising the U...",gideon,sa'ar
16,khatam anbiya,13.937813,9,9,True,125.440318,2026-03-22 21:05:02+00:00,2026-04-16 14:40:01+00:00,16637,2026-03-22 21:05:02+00:00,"😂 JUST IN - Spokesperson for the Iranian Armed Forces' Central Command Ebrahim Zolfaghari: ""Hey Trump! You are fired...",khatam,anbiya
17,amanda borschel,13.937813,8,8,True,111.502505,2025-12-27 06:53:14+00:00,2026-02-21 10:03:26+00:00,6502,2025-12-27 06:53:14+00:00,The Reel Schmooze: Jack Black's mother was a rocket scientist?! Movie maven Jordan Hoffman and host Amanda Borschel-...,amanda,borschel
18,max blumenthal,13.937813,7,7,True,97.564692,2026-04-12 04:04:48+00:00,2026-04-15 11:10:03+00:00,185098,2026-04-12 04:04:48+00:00,"""ONE OF THE GREATEST PEOPLE'S UPRISINGS IN MY LIFETIME"" Max Blumenthal says Iranians' nightly presence in the street...",max,blumenthal
19,brad cooper,13.937813,5,5,True,69.689066,2026-03-28 07:17:07+00:00,2026-04-16 12:35:02+00:00,74020,2026-03-28 07:17:07+00:00,"US Forces at Saudi Air Base Suffer Iranian Attack Multiple American service members were wounded, and some aircraft ...",brad,cooper
20,gerald ford,13.885346,6,6,True,83.312074,2026-02-13 12:41:32+00:00,2026-03-24 17:27:14+00:00,6933,2026-02-13 12:41:32+00:00,"The United States Navy is deploying the USS Gerald R. Ford, the world’s largest aircraft carrier, from Venezuela to ...",gerald,ford
21,deni avdija,13.844704,5,5,True,69.223519,2026-02-01 23:52:16+00:00,2026-04-15 17:11:58+00:00,6774,2026-02-01 23:52:16+00:00,"Making history, Deni Avdija becomes first Israeli selected for NBA All-Star Game Read more: https://toi.li/tZRbi6",deni,avdija
22,yom hashoah,13.648307,5,4,True,68.241533,2026-04-13 12:44:26+00:00,2026-04-14 10:21:46+00:00,74955,2026-04-13 12:44:26+00:00,"Ambassador Mike Huckabee: “As Yom HaShoah begins this evening, we remember the six million Jewish men, women, and ch...",yom,hashoah
23,yisrael chai,13.522776,12,12,True,162.273308,2026-02-24 12:56:31+00:00,2026-03-22 20:17:23+00:00,7027,2026-02-24 12:56:31+00:00,A group of Japanese tourists landed in Israel wearing matching Israeli vests and singing “Am Yisrael Chai.” 🇮🇱,yisrael,chai
24,los angeles,13.522776,11,11,True,148.750532,2026-01-14 10:02:04+00:00,2026-04-14 18:10:00+00:00,6645,2026-01-14 10:02:04+00:00,"Starlink is giving free internet access to Iranians during the regime’s nationwide blackout, activists say, offering...",los,angeles
25,jared kushner,13.522776,6,6,True,81.136654,2026-02-17 09:55:05+00:00,2026-04-11 21:15:38+00:00,6969,2026-02-17 09:55:05+00:00,"The United States and Iran have launched a second round of negotiations over Tehran’s nuclear program, according to ...",jared,kushner
26,shehbaz sharif,13.407298,11,11,True,147.480283,2026-01-18 14:02:41+00:00,2026-04-15 15:42:09+00:00,6670,2026-01-18 14:02:41+00:00,Pakistan has received an official invitation from President Donald Trump to join the newly formed “Board of Peace fo...,shehbaz,sharif
27,petah tikva,13.407298,12,11,True,160.887581,2026-03-08 12:28:59+00:00,2026-04-06 12:25:18+00:00,7346,2026-03-08 12:28:59+00:00,"Three people were injured after Iran launched a ballistic missile toward central Israel, with first responders suspe...",petah,tikva
28,yemen's ansarullah,13.407298,6,6,True,80.44379,2026-04-13 09:01:09+00:00,2026-04-17 08:38:43+00:00,185254,2026-04-13 09:01:09+00:00,Yemen’s Ansarullah resistance movement warned that it will intensify its military operations if the US and Israeli r...,yemen's,ansarullah
29,joseph aoun,13.385272,10,10,True,133.852721,2026-04-09 15:40:07+00:00,2026-04-17 17:25:00+00:00,74802,2026-04-09 15:40:07+00:00,"Senior Israeli official: The one who will lead the direct negotiations is Israeli Ambassador to Washington, Yechiel ...",joseph,aoun
30,territorial integrity,13.385272,10,9,True,133.852721,2026-03-09 08:27:29+00:00,2026-04-17 07:03:39+00:00,7364,2026-03-09 08:27:29+00:00,"China said it opposes any targeting of Iran’s new Supreme Leader, Mojtaba Khamenei, after threats were made against ...",territorial,integrity
